{
  "artifact_hash": "sha256:a81610d71ba9e8caed927e4274e7a86be4e9982acdf3ef91d6d2231abc7777ae",
  "artifact_kind": "persona_v3_ai_source_prereview",
  "assurance_class": "machine_pre_review_only",
  "candidate_id": "marks_oaktree_its_all_good_2007",
  "disagreement": {
    "explanation": "The roles have different scopes but agree that no source approval or method attribution is established.",
    "present": false,
    "role_verdicts": [
      "archive_integrity_verified_semantics_unreviewed",
      "production_approval_unsupported",
      "requires_human_review"
    ]
  },
  "human_claims": false,
  "human_reviewed": false,
  "machine_limitations": [
    "This artifact is deterministic machine triage, not an independent human review.",
    "It does not contain a verified semantic extraction or exact source locator.",
    "It is unsigned, cannot enter a trusted reviewer registry, and cannot satisfy source-review quorum."
  ],
  "method_attribution_approved": false,
  "open_questions": [
    "Which exact page, section, filing item, or timestamp supports a proposed method proposition?",
    "Who is the verified author or speaker for that exact passage?",
    "What published_at and public_at values are supported by the archived material?"
  ],
  "persona_id": "master_marks",
  "pipeline_id": "alphacouncil_ai_source_prereview_v1",
  "production_effect": "none",
  "reviewer_kind": "ai",
  "roles": [
    {
      "concerns": [
        "Archive integrity alone does not establish method-defining evidence."
      ],
      "execution_mode": "deterministic_machine_preflight",
      "input_binding_hash": "sha256:e9656c4e81c9fc3d968530956d3c9ab093127cd2969977063baf24d23f6d7e40",
      "input_role_output_hashes": [],
      "observations": [
        "The archived byte stream matches the acquisition record's content hash and byte length.",
        "The declared content type is application/pdf; the deterministic format probe is pdf_magic.",
        "This bootstrap pass did not extract or verify a semantic proposition, authorship claim, date, grade, or exact locator."
      ],
      "open_questions": [
        "Which exact page, section, filing item, or timestamp supports a proposed method proposition?",
        "Who is the verified author or speaker for that exact passage?",
        "What published_at and public_at values are supported by the archived material?"
      ],
      "output_hash": "sha256:06ce472acd8cb7108c45ad201a7883a796b7a7fdd5c84a30f605df018855e442",
      "prompt_hash": "sha256:3c5ed3beaa183923297e451df14c0f1fc2274478cad9d5a0b7309b2750da1e52",
      "prompt_id": "alphacouncil.source-prereview.extractor.v1",
      "reads_other_role_outputs": false,
      "reviewer_kind": "ai",
      "role": "extractor",
      "role_id": "ai_source_extractor_v1",
      "verdict": "archive_integrity_verified_semantics_unreviewed"
    },
    {
      "concerns": [
        "No exact passage has been bound to a method proposition.",
        "Authorship, publication timing, source grade, and scope remain unresolved in this pre-review."
      ],
      "execution_mode": "deterministic_machine_preflight",
      "input_binding_hash": "sha256:6638b221defafd2617a16dbcca91857f56a0f8ca33fcc82198b322f1be254ea5",
      "input_role_output_hashes": [],
      "observations": [
        "The acquisition remains retrieved_unadjudicated.",
        "The acquisition's human_review.status remains not_requested.",
        "The machine input contains no verified exact locator or proposition-to-passage binding."
      ],
      "open_questions": [
        "Which exact page, section, filing item, or timestamp supports a proposed method proposition?",
        "Who is the verified author or speaker for that exact passage?",
        "What published_at and public_at values are supported by the archived material?"
      ],
      "output_hash": "sha256:761da757654dce2bca4299c5adf4481b07a44aaeaa5fc0baf0c73a070df9a992",
      "prompt_hash": "sha256:d4564717eafa5f0448e3832a56c70da95358a164fe2fec01354887e071b75738",
      "prompt_id": "alphacouncil.source-prereview.skeptic.v1",
      "reads_other_role_outputs": false,
      "reviewer_kind": "ai",
      "role": "skeptic",
      "role_id": "ai_source_skeptic_v1",
      "verdict": "production_approval_unsupported"
    },
    {
      "concerns": [
        "Promoting this artifact would confuse machine triage with trusted human source adjudication."
      ],
      "execution_mode": "deterministic_machine_preflight",
      "input_binding_hash": "sha256:2f22e0e0365fe72e0a77096e006b0735a0dfdd53363a8804b93dfbe0cbbd89cf",
      "input_role_output_hashes": [
        "sha256:06ce472acd8cb7108c45ad201a7883a796b7a7fdd5c84a30f605df018855e442",
        "sha256:761da757654dce2bca4299c5adf4481b07a44aaeaa5fc0baf0c73a070df9a992"
      ],
      "observations": [
        "The extractor established archive integrity but explicitly performed no semantic review.",
        "The skeptic found no verified proposition-to-locator binding for production use.",
        "The two independent first-pass roles agree that machine pre-review cannot approve this source."
      ],
      "open_questions": [
        "Which exact page, section, filing item, or timestamp supports a proposed method proposition?",
        "Who is the verified author or speaker for that exact passage?",
        "What published_at and public_at values are supported by the archived material?"
      ],
      "output_hash": "sha256:dbe841af1f621e370412cf6175a51e0f87df6c4f79c91d82d89ea714bb3a8445",
      "prompt_hash": "sha256:18d54becf6953007bfbab91bbb5955bcf9ffc0989a0948d0d27ab751fa0a82a6",
      "prompt_id": "alphacouncil.source-prereview.adjudicator.v1",
      "reads_other_role_outputs": true,
      "reviewer_kind": "ai",
      "role": "adjudicator",
      "role_id": "ai_source_adjudicator_v1",
      "verdict": "requires_human_review"
    }
  ],
  "schema_version": 1,
  "semantic_review_performed": false,
  "source_binding": {
    "archive_relative_path": "personas-v3/master_marks/acquisitions/candidates/marks_oaktree_its_all_good_2007/source.bin",
    "byte_length": 80733,
    "content_hash": "sha256:0d67e5c2f0a452c57acc629ae9337bcbd2eadaa99c3c946c8b5639a0d5c18de9",
    "content_type": "application/pdf",
    "final_url": "https://www.oaktreecapital.com/docs/default-source/memos/2007-07-16-its-all-good.pdf?sfvrsn=8fbc0f65_6",
    "format_probe": "pdf_magic",
    "record_hash": "sha256:27bb3a95ecd83089b22c75adae4ea63f2a25363e17bbfe60c2f5222f7d3a46cb",
    "record_relative_path": "personas-v3/master_marks/acquisitions/candidates/marks_oaktree_its_all_good_2007/record.json",
    "retrieved_at": "2026-07-27T06:34:01.739Z",
    "source_bytes_reverified": true
  },
  "verdict": "requires_human_review"
}
