{
  "artifact_hash": "sha256:8ac9c2f2a69b2afaa48e54e88919b36d77215bd4df44a6446c3335cd36b37371",
  "artifact_kind": "persona_v3_ai_source_prereview",
  "assurance_class": "machine_pre_review_only",
  "candidate_id": "li_lu_pku_speech_notes_2019",
  "disagreement": {
    "explanation": "The roles have different scopes but agree that no source approval or method attribution is established.",
    "present": false,
    "role_verdicts": [
      "archive_integrity_verified_semantics_unreviewed",
      "production_approval_unsupported",
      "requires_human_review"
    ]
  },
  "human_claims": false,
  "human_reviewed": false,
  "machine_limitations": [
    "This artifact is deterministic machine triage, not an independent human review.",
    "It does not contain a verified semantic extraction or exact source locator.",
    "It is unsigned, cannot enter a trusted reviewer registry, and cannot satisfy source-review quorum."
  ],
  "method_attribution_approved": false,
  "open_questions": [
    "Which exact page, section, filing item, or timestamp supports a proposed method proposition?",
    "Who is the verified author or speaker for that exact passage?",
    "What published_at and public_at values are supported by the archived material?"
  ],
  "persona_id": "master_li_lu",
  "pipeline_id": "alphacouncil_ai_source_prereview_v1",
  "production_effect": "none",
  "reviewer_kind": "ai",
  "roles": [
    {
      "concerns": [
        "Archive integrity alone does not establish method-defining evidence."
      ],
      "execution_mode": "deterministic_machine_preflight",
      "input_binding_hash": "sha256:6414d3e2c6488029d25d33cbca73054ce9de7aaff1172d3d48b1a3553c2e47f9",
      "input_role_output_hashes": [],
      "observations": [
        "The archived byte stream matches the acquisition record's content hash and byte length.",
        "The declared content type is text/html; the deterministic format probe is html_markup.",
        "This bootstrap pass did not extract or verify a semantic proposition, authorship claim, date, grade, or exact locator."
      ],
      "open_questions": [
        "Which exact page, section, filing item, or timestamp supports a proposed method proposition?",
        "Who is the verified author or speaker for that exact passage?",
        "What published_at and public_at values are supported by the archived material?"
      ],
      "output_hash": "sha256:322efb41206928bb64b33bfbbb1933b4eaadaec5bb2fd06cf691b19053a7cdf5",
      "prompt_hash": "sha256:3c5ed3beaa183923297e451df14c0f1fc2274478cad9d5a0b7309b2750da1e52",
      "prompt_id": "alphacouncil.source-prereview.extractor.v1",
      "reads_other_role_outputs": false,
      "reviewer_kind": "ai",
      "role": "extractor",
      "role_id": "ai_source_extractor_v1",
      "verdict": "archive_integrity_verified_semantics_unreviewed"
    },
    {
      "concerns": [
        "No exact passage has been bound to a method proposition.",
        "Authorship, publication timing, source grade, and scope remain unresolved in this pre-review."
      ],
      "execution_mode": "deterministic_machine_preflight",
      "input_binding_hash": "sha256:a77e4ec2ba2b59a9803be1dac0b5fb11ae83301aa3979e9abb5e25e9d8ab3732",
      "input_role_output_hashes": [],
      "observations": [
        "The acquisition remains retrieved_unadjudicated.",
        "The acquisition's human_review.status remains not_requested.",
        "The machine input contains no verified exact locator or proposition-to-passage binding."
      ],
      "open_questions": [
        "Which exact page, section, filing item, or timestamp supports a proposed method proposition?",
        "Who is the verified author or speaker for that exact passage?",
        "What published_at and public_at values are supported by the archived material?"
      ],
      "output_hash": "sha256:4f61b89f1a5d7b8978b69c07230bdf80684c2b28cd947afcfcc6a3fe1c8400a8",
      "prompt_hash": "sha256:d4564717eafa5f0448e3832a56c70da95358a164fe2fec01354887e071b75738",
      "prompt_id": "alphacouncil.source-prereview.skeptic.v1",
      "reads_other_role_outputs": false,
      "reviewer_kind": "ai",
      "role": "skeptic",
      "role_id": "ai_source_skeptic_v1",
      "verdict": "production_approval_unsupported"
    },
    {
      "concerns": [
        "Promoting this artifact would confuse machine triage with trusted human source adjudication."
      ],
      "execution_mode": "deterministic_machine_preflight",
      "input_binding_hash": "sha256:b54fb7206b6f39da4b02a00e87dbccc9e3d724af21da8a7bf3e139a0a6fb7076",
      "input_role_output_hashes": [
        "sha256:322efb41206928bb64b33bfbbb1933b4eaadaec5bb2fd06cf691b19053a7cdf5",
        "sha256:4f61b89f1a5d7b8978b69c07230bdf80684c2b28cd947afcfcc6a3fe1c8400a8"
      ],
      "observations": [
        "The extractor established archive integrity but explicitly performed no semantic review.",
        "The skeptic found no verified proposition-to-locator binding for production use.",
        "The two independent first-pass roles agree that machine pre-review cannot approve this source."
      ],
      "open_questions": [
        "Which exact page, section, filing item, or timestamp supports a proposed method proposition?",
        "Who is the verified author or speaker for that exact passage?",
        "What published_at and public_at values are supported by the archived material?"
      ],
      "output_hash": "sha256:421295863d33b6c0dc8afb76f6d44bf338f6b3783f93401e473add9c3cc3c681",
      "prompt_hash": "sha256:18d54becf6953007bfbab91bbb5955bcf9ffc0989a0948d0d27ab751fa0a82a6",
      "prompt_id": "alphacouncil.source-prereview.adjudicator.v1",
      "reads_other_role_outputs": true,
      "reviewer_kind": "ai",
      "role": "adjudicator",
      "role_id": "ai_source_adjudicator_v1",
      "verdict": "requires_human_review"
    }
  ],
  "schema_version": 1,
  "semantic_review_performed": false,
  "source_binding": {
    "archive_relative_path": "personas-v3/master_li_lu/acquisitions/candidates/li_lu_pku_speech_notes_2019/source.bin",
    "byte_length": 33831,
    "content_hash": "sha256:3dfe0c5406e3d76b69673b3377837816bad4feaeb8d7134c88be8d1413cdfa77",
    "content_type": "text/html",
    "final_url": "https://english.pku.edu.cn/PKUmedia/9386.html",
    "format_probe": "html_markup",
    "record_hash": "sha256:2fa2cc980acd68f469c1a2a9fc733cf782ce7b4f148a25ef261988bc7b7e3ab5",
    "record_relative_path": "personas-v3/master_li_lu/acquisitions/candidates/li_lu_pku_speech_notes_2019/record.json",
    "retrieved_at": "2026-07-27T06:35:08.502Z",
    "source_bytes_reverified": true
  },
  "verdict": "requires_human_review"
}
