{
  "artifact_hash": "sha256:862663d79a25447dcf73f710e30cf47bd98165d04bc41951a2a9736ed1f8b416",
  "artifact_kind": "persona_v3_ai_source_prereview",
  "assurance_class": "machine_pre_review_only",
  "candidate_id": "dalio_economic_principles_productivity_reform",
  "disagreement": {
    "explanation": "The roles have different scopes but agree that no source approval or method attribution is established.",
    "present": false,
    "role_verdicts": [
      "archive_integrity_verified_semantics_unreviewed",
      "production_approval_unsupported",
      "requires_human_review"
    ]
  },
  "human_claims": false,
  "human_reviewed": false,
  "machine_limitations": [
    "This artifact is deterministic machine triage, not an independent human review.",
    "It does not contain a verified semantic extraction or exact source locator.",
    "It is unsigned, cannot enter a trusted reviewer registry, and cannot satisfy source-review quorum."
  ],
  "method_attribution_approved": false,
  "open_questions": [
    "Which exact page, section, filing item, or timestamp supports a proposed method proposition?",
    "Who is the verified author or speaker for that exact passage?",
    "What published_at and public_at values are supported by the archived material?"
  ],
  "persona_id": "master_dalio",
  "pipeline_id": "alphacouncil_ai_source_prereview_v1",
  "production_effect": "none",
  "reviewer_kind": "ai",
  "roles": [
    {
      "concerns": [
        "Archive integrity alone does not establish method-defining evidence."
      ],
      "execution_mode": "deterministic_machine_preflight",
      "input_binding_hash": "sha256:25c185c25e2d1208489f5bca685aafe8be71779cbc8f8487f10c521d26760b6c",
      "input_role_output_hashes": [],
      "observations": [
        "The archived byte stream matches the acquisition record's content hash and byte length.",
        "The declared content type is application/pdf; the deterministic format probe is pdf_magic.",
        "This bootstrap pass did not extract or verify a semantic proposition, authorship claim, date, grade, or exact locator."
      ],
      "open_questions": [
        "Which exact page, section, filing item, or timestamp supports a proposed method proposition?",
        "Who is the verified author or speaker for that exact passage?",
        "What published_at and public_at values are supported by the archived material?"
      ],
      "output_hash": "sha256:99536cd641b4e38d5c2eba2d5becfaaa3e5880349146173ed357bce7deaf38e4",
      "prompt_hash": "sha256:3c5ed3beaa183923297e451df14c0f1fc2274478cad9d5a0b7309b2750da1e52",
      "prompt_id": "alphacouncil.source-prereview.extractor.v1",
      "reads_other_role_outputs": false,
      "reviewer_kind": "ai",
      "role": "extractor",
      "role_id": "ai_source_extractor_v1",
      "verdict": "archive_integrity_verified_semantics_unreviewed"
    },
    {
      "concerns": [
        "No exact passage has been bound to a method proposition.",
        "Authorship, publication timing, source grade, and scope remain unresolved in this pre-review."
      ],
      "execution_mode": "deterministic_machine_preflight",
      "input_binding_hash": "sha256:2fe3d705771d41fd0fd0827bc23dfd413bec14175e7635998b7c0a0ffca6bd85",
      "input_role_output_hashes": [],
      "observations": [
        "The acquisition remains retrieved_unadjudicated.",
        "The acquisition's human_review.status remains not_requested.",
        "The machine input contains no verified exact locator or proposition-to-passage binding."
      ],
      "open_questions": [
        "Which exact page, section, filing item, or timestamp supports a proposed method proposition?",
        "Who is the verified author or speaker for that exact passage?",
        "What published_at and public_at values are supported by the archived material?"
      ],
      "output_hash": "sha256:de0f2448a6fc45d9eb379d7bcdaf80cf07de552f9ebb84147b9f4b3124079c7a",
      "prompt_hash": "sha256:d4564717eafa5f0448e3832a56c70da95358a164fe2fec01354887e071b75738",
      "prompt_id": "alphacouncil.source-prereview.skeptic.v1",
      "reads_other_role_outputs": false,
      "reviewer_kind": "ai",
      "role": "skeptic",
      "role_id": "ai_source_skeptic_v1",
      "verdict": "production_approval_unsupported"
    },
    {
      "concerns": [
        "Promoting this artifact would confuse machine triage with trusted human source adjudication."
      ],
      "execution_mode": "deterministic_machine_preflight",
      "input_binding_hash": "sha256:7f4b9ebd905cf5778deb981a240683389a1934fdb688001a1af1e445b3dd05e3",
      "input_role_output_hashes": [
        "sha256:99536cd641b4e38d5c2eba2d5becfaaa3e5880349146173ed357bce7deaf38e4",
        "sha256:de0f2448a6fc45d9eb379d7bcdaf80cf07de552f9ebb84147b9f4b3124079c7a"
      ],
      "observations": [
        "The extractor established archive integrity but explicitly performed no semantic review.",
        "The skeptic found no verified proposition-to-locator binding for production use.",
        "The two independent first-pass roles agree that machine pre-review cannot approve this source."
      ],
      "open_questions": [
        "Which exact page, section, filing item, or timestamp supports a proposed method proposition?",
        "Who is the verified author or speaker for that exact passage?",
        "What published_at and public_at values are supported by the archived material?"
      ],
      "output_hash": "sha256:19c7022404b28323cbfdc32b9aa20fc2157cf3d092c22176fca6e76484c919e4",
      "prompt_hash": "sha256:18d54becf6953007bfbab91bbb5955bcf9ffc0989a0948d0d27ab751fa0a82a6",
      "prompt_id": "alphacouncil.source-prereview.adjudicator.v1",
      "reads_other_role_outputs": true,
      "reviewer_kind": "ai",
      "role": "adjudicator",
      "role_id": "ai_source_adjudicator_v1",
      "verdict": "requires_human_review"
    }
  ],
  "schema_version": 1,
  "semantic_review_performed": false,
  "source_binding": {
    "archive_relative_path": "personas-v3/master_dalio/acquisitions/candidates/dalio_economic_principles_productivity_reform/source.bin",
    "byte_length": 1658914,
    "content_hash": "sha256:8fa2d8f8783d2f31639da86cb206e8f9aeed0d924ebd413d5d1028e420630943",
    "content_type": "application/pdf",
    "final_url": "https://www.economicprinciples.org/downloads/ray_dalio__how_the_economic_machine_works__leveragings_and_deleveragings.pdf?direct=1",
    "format_probe": "pdf_magic",
    "record_hash": "sha256:93f45e2ad4eee5f259fe9232e468d6317acb33459d04b8c9381ff4f8f5823eeb",
    "record_relative_path": "personas-v3/master_dalio/acquisitions/candidates/dalio_economic_principles_productivity_reform/record.json",
    "retrieved_at": "2026-07-27T06:36:23.578Z",
    "source_bytes_reverified": true
  },
  "verdict": "requires_human_review"
}
