{
  "artifact_hash": "sha256:2e1157ed6b16949216472e68c803fd7e779cc0803f1628cdc87be21fde455820",
  "artifact_kind": "persona_v3_ai_source_prereview",
  "assurance_class": "machine_pre_review_only",
  "candidate_id": "taleb_precautionary_principle_ruin",
  "disagreement": {
    "explanation": "The roles have different scopes but agree that no source approval or method attribution is established.",
    "present": false,
    "role_verdicts": [
      "archive_integrity_verified_semantics_unreviewed",
      "production_approval_unsupported",
      "requires_human_review"
    ]
  },
  "human_claims": false,
  "human_reviewed": false,
  "machine_limitations": [
    "This artifact is deterministic machine triage, not an independent human review.",
    "It does not contain a verified semantic extraction or exact source locator.",
    "It is unsigned, cannot enter a trusted reviewer registry, and cannot satisfy source-review quorum."
  ],
  "method_attribution_approved": false,
  "open_questions": [
    "Which exact page, section, filing item, or timestamp supports a proposed method proposition?",
    "Who is the verified author or speaker for that exact passage?",
    "What published_at and public_at values are supported by the archived material?"
  ],
  "persona_id": "master_taleb",
  "pipeline_id": "alphacouncil_ai_source_prereview_v1",
  "production_effect": "none",
  "reviewer_kind": "ai",
  "roles": [
    {
      "concerns": [
        "Archive integrity alone does not establish method-defining evidence."
      ],
      "execution_mode": "deterministic_machine_preflight",
      "input_binding_hash": "sha256:a9e8cba644838e4f123345c8632c33a369683790d9a72860fd9c8f2360ca96ec",
      "input_role_output_hashes": [],
      "observations": [
        "The archived byte stream matches the acquisition record's content hash and byte length.",
        "The declared content type is application/pdf; the deterministic format probe is pdf_magic.",
        "This bootstrap pass did not extract or verify a semantic proposition, authorship claim, date, grade, or exact locator."
      ],
      "open_questions": [
        "Which exact page, section, filing item, or timestamp supports a proposed method proposition?",
        "Who is the verified author or speaker for that exact passage?",
        "What published_at and public_at values are supported by the archived material?"
      ],
      "output_hash": "sha256:691ef46e0558c7a318cc484555948307c9648b0dd99beaefaa68bab3004112a5",
      "prompt_hash": "sha256:3c5ed3beaa183923297e451df14c0f1fc2274478cad9d5a0b7309b2750da1e52",
      "prompt_id": "alphacouncil.source-prereview.extractor.v1",
      "reads_other_role_outputs": false,
      "reviewer_kind": "ai",
      "role": "extractor",
      "role_id": "ai_source_extractor_v1",
      "verdict": "archive_integrity_verified_semantics_unreviewed"
    },
    {
      "concerns": [
        "No exact passage has been bound to a method proposition.",
        "Authorship, publication timing, source grade, and scope remain unresolved in this pre-review."
      ],
      "execution_mode": "deterministic_machine_preflight",
      "input_binding_hash": "sha256:17b4d866184a192ef516dd6d457982dcbad19aa5a7d1a82c095436e9e6984a2d",
      "input_role_output_hashes": [],
      "observations": [
        "The acquisition remains retrieved_unadjudicated.",
        "The acquisition's human_review.status remains not_requested.",
        "The machine input contains no verified exact locator or proposition-to-passage binding."
      ],
      "open_questions": [
        "Which exact page, section, filing item, or timestamp supports a proposed method proposition?",
        "Who is the verified author or speaker for that exact passage?",
        "What published_at and public_at values are supported by the archived material?"
      ],
      "output_hash": "sha256:bc0119f8b70bbb1eb97ef648b2b0bacc82b49f5146db430ef897ffcfc5095279",
      "prompt_hash": "sha256:d4564717eafa5f0448e3832a56c70da95358a164fe2fec01354887e071b75738",
      "prompt_id": "alphacouncil.source-prereview.skeptic.v1",
      "reads_other_role_outputs": false,
      "reviewer_kind": "ai",
      "role": "skeptic",
      "role_id": "ai_source_skeptic_v1",
      "verdict": "production_approval_unsupported"
    },
    {
      "concerns": [
        "Promoting this artifact would confuse machine triage with trusted human source adjudication."
      ],
      "execution_mode": "deterministic_machine_preflight",
      "input_binding_hash": "sha256:f210a5c2b3de401a959f34fbb7823189d7a531a97caf7af15e571fda71434cdd",
      "input_role_output_hashes": [
        "sha256:691ef46e0558c7a318cc484555948307c9648b0dd99beaefaa68bab3004112a5",
        "sha256:bc0119f8b70bbb1eb97ef648b2b0bacc82b49f5146db430ef897ffcfc5095279"
      ],
      "observations": [
        "The extractor established archive integrity but explicitly performed no semantic review.",
        "The skeptic found no verified proposition-to-locator binding for production use.",
        "The two independent first-pass roles agree that machine pre-review cannot approve this source."
      ],
      "open_questions": [
        "Which exact page, section, filing item, or timestamp supports a proposed method proposition?",
        "Who is the verified author or speaker for that exact passage?",
        "What published_at and public_at values are supported by the archived material?"
      ],
      "output_hash": "sha256:137c4da9566ab5c1eb38dc0965d60c67922163a9dcc2e4364080051fac2e785d",
      "prompt_hash": "sha256:18d54becf6953007bfbab91bbb5955bcf9ffc0989a0948d0d27ab751fa0a82a6",
      "prompt_id": "alphacouncil.source-prereview.adjudicator.v1",
      "reads_other_role_outputs": true,
      "reviewer_kind": "ai",
      "role": "adjudicator",
      "role_id": "ai_source_adjudicator_v1",
      "verdict": "requires_human_review"
    }
  ],
  "schema_version": 1,
  "semantic_review_performed": false,
  "source_binding": {
    "archive_relative_path": "personas-v3/master_taleb/acquisitions/candidates/taleb_precautionary_principle_ruin/source.bin",
    "byte_length": 1245535,
    "content_hash": "sha256:7ef0b4ea3f2e372701262e96fff7c492a48cefb9faebaf3849b5d20abb15f361",
    "content_type": "application/pdf",
    "final_url": "https://www.fooledbyrandomness.com/pp2.pdf",
    "format_probe": "pdf_magic",
    "record_hash": "sha256:73c130cd84eee1b82b34c75c1d0d535d42d94456c27bc41b76ee48cdd4f48b71",
    "record_relative_path": "personas-v3/master_taleb/acquisitions/candidates/taleb_precautionary_principle_ruin/record.json",
    "retrieved_at": "2026-07-27T10:23:12.323Z",
    "source_bytes_reverified": true
  },
  "verdict": "requires_human_review"
}
